{
  "schema_version": "1.0",
  "task_id": "repair-auth-017",
  "decision_type": "task_completion",
  "evaluation_name": "repository.tests_pass",
  "authority": "math",
  "evaluator": {
    "kind": "json_equality",
    "expected": {
      "status": "ok",
      "rows": [
        1,
        2,
        3
      ]
    }
  }
}
