{
  "schema_version": "1.0",
  "task_id": "repair-auth-017",
  "decision_type": "task_completion",
  "evaluation_name": "repository.tests_pass",
  "authority": "math",
  "evaluator": {
    "kind": "json_schema",
    "schema": {
      "type": "object",
      "required": [
        "id"
      ],
      "properties": {
        "id": {
          "type": "string"
        }
      }
    }
  }
}
